date,title,label,label_volatility,impact_type,impact_class,section,sentiment,title_len,num_words,clean_title,ticker
2022-01-25,"ФАС возбудила дело о завышении цен на бензин против ""дочек"" ""ЛУКОЙЛа"" и ""Газпром нефти""",0,0,trend,neutral,business,0,87,7,возбудить дело завышение цена бензин дочка нефть,GAZP
2022-02-07,"""Газпром"" пожаловался, что Молдавия назначила аудитора долга без учета его мнения",0,0,trend,neutral,business,0,81,7,газпром пожаловаться назначить аудитор долг учет мнение,GAZP
2022-02-07,"""Газпром"" пожаловался, что Молдавия назначила аудитора долга без учета его мнения",0,0,trend,neutral,business,0,81,7,газпром пожаловаться назначить аудитор долг учет мнение,GAZP
2022-02-10,"""Газпром"" подтвердил, что рассматривает возможность buyback",-1,0,trend,down,business,0,59,4,газпром подтвердить рассматривать возможность,GAZP
2022-02-10,"""Молдовагаз"" заявил, что заплатил ""Газпрому более трети суммы текущих платежей за газ",-1,0,trend,down,world,0,85,8,заявить заплатить более треть сумма текущий платеж газ,GAZP
2022-02-14,"""Молдовагаз"" объявил, что полностью рассчитался с ""Газпромом"" за январь",1,0,trend,up,business,0,71,4,объявить полностью рассчитаться январь,GAZP
2022-02-16,"""Газпром нефть"" в 2022 г. привлечет ""зеленое"" финансирование для проектов в переработке",-1,1,"trend,volatility",down_vol,business,0,87,9,газпром нефть 2022 г привлечь зеленый финансирование проект переработка,GAZP
2022-02-16,"""Газпром нефть"" в 2022 г. привлечет ""зеленое"" финансирование для проектов в переработке",-1,1,"trend,volatility",down_vol,business,0,87,9,газпром нефть 2022 г привлечь зеленый финансирование проект переработка,GAZP
2022-02-21,"Транзитная заявка ""Газпрома"" через Украину на среду будет на уровне вторника",1,1,"trend,volatility",up_vol,business,0,76,5,транзитный заявка среда уровень вторник,GAZP
2022-02-21,"Транзитная заявка ""Газпрома"" через Украину на среду будет на уровне вторника",1,1,"trend,volatility",up_vol,business,0,76,5,транзитный заявка среда уровень вторник,GAZP
2022-03-24,"""Газпром"" заказал оценку последствий разных вариантов монетизации запасов газа",-1,1,"trend,volatility",down_vol,business,0,78,9,газпром заказать оценка последствие разный вариант монетизация запас газ,GAZP
2022-03-24,"""Газпром"" заказал оценку последствий разных вариантов монетизации запасов газа",-1,1,"trend,volatility",down_vol,business,0,78,9,газпром заказать оценка последствие разный вариант монетизация запас газ,GAZP
2022-03-24,"""Газпром"" перевел свои закупки в неконкурентный режим",-1,1,"trend,volatility",down_vol,business,0,53,5,газпром перевести закупка неконкурентный режим,GAZP
2022-03-28,"Транзит ""Газпрома"" через Украину в воскресенье сохраняется на максимуме",-1,0,trend,down,business,0,71,4,транзит воскресение сохраняться максимум,GAZP
2022-03-28,"Транзит ""Газпрома"" через Украину в воскресенье сохраняется на максимуме",-1,0,trend,down,business,0,71,4,транзит воскресение сохраняться максимум,GAZP
2022-03-28,"Хорватская JANAF прекратит прокачку нефти сербской структуре ""Газпром нефти""",-1,0,trend,down,business,0,76,8,хорватский прекратить прокачка нефть сербский структура газпром нефть,GAZP
2022-03-28,"""Газпром"" забронировал часть мощностей ""Ямала-Европа"" на ночь со вторника на среду",-1,0,trend,down,business,0,82,7,газпром забронировать часть мощность ночь вторник среда,GAZP
2022-03-28,"Хорватская JANAF прекратит прокачку нефти сербской структуре ""Газпром нефти""",-1,0,trend,down,business,0,76,8,хорватский прекратить прокачка нефть сербский структура газпром нефть,GAZP
2022-03-28,"""Газпром"" забронировал часть мощностей ""Ямала-Европа"" на ночь со вторника на среду",-1,0,trend,down,business,0,82,7,газпром забронировать часть мощность ночь вторник среда,GAZP
2022-03-29,"Bloomberg сообщил о проверках в офисах ""дочек"" ""Газпрома"" в Германии",1,1,"trend,volatility",up_vol,business,0,68,4,сообщить проверка офис дочка,GAZP
2022-03-29,"""Газпром"" забронировал 30% ""Ямала-Европы"" на ближайшую ночь на фоне похолодания в ЕС",1,1,"trend,volatility",up_vol,business,0,84,7,газпром забронировать ямал-европа близкий ночь фон похолодание,GAZP
2022-03-28,"Хорватская JANAF прекратит прокачку нефти сербской структуре ""Газпром нефти""",-1,0,trend,down,business,0,76,8,хорватский прекратить прокачка нефть сербский структура газпром нефть,GAZP
2022-03-28,"""Газпром"" забронировал часть мощностей ""Ямала-Европа"" на ночь со вторника на среду",-1,0,trend,down,business,0,82,7,газпром забронировать часть мощность ночь вторник среда,GAZP
2022-03-29,"Bloomberg сообщил о проверках в офисах ""дочек"" ""Газпрома"" в Германии",1,1,"trend,volatility",up_vol,business,0,68,4,сообщить проверка офис дочка,GAZP
2022-03-29,"""Газпром"" забронировал 30% ""Ямала-Европы"" на ближайшую ночь на фоне похолодания в ЕС",1,1,"trend,volatility",up_vol,business,0,84,7,газпром забронировать ямал-европа близкий ночь фон похолодание,GAZP
2022-03-29,"Bloomberg сообщил о проверках в офисах ""дочек"" ""Газпрома"" в Германии",1,1,"trend,volatility",up_vol,business,0,68,4,сообщить проверка офис дочка,GAZP
2022-03-29,"""Газпром"" забронировал 30% ""Ямала-Европы"" на ближайшую ночь на фоне похолодания в ЕС",1,1,"trend,volatility",up_vol,business,0,84,7,газпром забронировать ямал-европа близкий ночь фон похолодание,GAZP
2022-04-04,"Заявка ""Газпрома"" на транзит через Украину осталась максимальной на фоне похолодания",-1,0,trend,down,business,0,84,6,заявка транзит остаться максимальный фон похолодание,GAZP
2022-04-04,"""Газпром"" частично бронирует ""Ямал-Европу"" на ближайшую ночь и вторник",-1,0,trend,down,business,0,70,6,газпром частично бронировать близкий ночь вторник,GAZP
2022-04-04,"Bloomberg сообщил, что власти ФРГ ищут покупателя на активы ""Газпрома""",-1,0,trend,down,business,0,70,5,сообщить власть искать покупатель актив,GAZP
2022-04-11,"""Газпром"" не стал обжаловать решение суда по спору с PGNIG на $1,5 млрд",0,0,trend,neutral,business,0,71,7,газпром стать обжаловать решение суд спор млрд,GAZP
2022-04-13,"Правление ""Газпрома"" предложило провести ГОСА в форме заочного голосования",-1,1,"trend,volatility",down_vol,business,0,74,5,предложить провести форма заочный голосование,GAZP
2022-04-20,Великобритания разрешила платежи за газ в адрес Газпромбанка до 31 мая,-1,1,"trend,volatility",down_vol,world,0,70,6,разрешить платеж газ адрес 31 май,GAZP
2022-04-20,"""Газпром"" утвердил график ремонта экспортных газопроводов",-1,1,"trend,volatility",down_vol,business,0,57,6,газпром утвердить график ремонт экспортный газопровод,GAZP
2022-04-25,"Болгария отказалась платить ""Газпрому"" по новой схеме и ожидает прекращения поставок",1,1,"trend,volatility",up_vol,business,0,84,7,отказаться платить новый схема ожидать прекращение поставка,GAZP
2022-04-25,"""Газпром"" не подтвердил прекращение поставок Польше",1,1,"trend,volatility",up_vol,business,0,51,4,газпром подтвердить прекращение поставка,GAZP
2022-04-25,"Болгария отказалась платить ""Газпрому"" по новой схеме и ожидает прекращения поставок",1,1,"trend,volatility",up_vol,business,0,84,7,отказаться платить новый схема ожидать прекращение поставка,GAZP
2022-04-25,"""Газпром"" не подтвердил прекращение поставок Польше",1,1,"trend,volatility",up_vol,business,0,51,4,газпром подтвердить прекращение поставка,GAZP
2022-04-26,Итальянская Eni откроет рублевые счета в Газпромбанке для оплаты газа из РФ,1,0,trend,up,business,0,75,6,итальянский открыть рублевый счет оплата газ,GAZP
2022-05-11,"""Газпром"" отверг основания для объявления Киевом форс-мажора по транзиту",-1,1,"trend,volatility",down_vol,business,0,72,6,газпром отвергнуть основание объявление форс-мажор транзит,GAZP
2022-05-11,"""Газпром нефть"" снизила долю в сербской NIS в пользу ""Газпрома""",-1,1,"trend,volatility",down_vol,business,0,63,6,газпром нефть снизить доля сербский польза,GAZP
2022-05-11,"Болгария будет получать газ из США по ценам ниже, чем у ""Газпрома""",-1,1,"trend,volatility",down_vol,business,0,66,4,получать газ цена ниже,GAZP
2022-05-16,"Eni пока не открывала счета в Газпромбанке, но рассматривает эту возможность",1,1,"trend,volatility",up_vol,business,0,76,5,пока открывать счет рассматривать возможность,GAZP
2022-05-16,"Eni пока не открывала счета в Газпромбанке, но рассматривает эту возможность",1,1,"trend,volatility",up_vol,business,0,76,5,пока открывать счет рассматривать возможность,GAZP
2022-05-23,"Герхард Шредер отказался от предложения войти в совет директоров ""Газпрома""",0,0,trend,neutral,world,0,75,5,отказаться предложение войти совет директор,GAZP
2022-05-23,"Девелопер затянувшегося газопроводного проекта в Подмосковье не смог взыскать убытки с ""Газпрома""",0,0,trend,neutral,moscow,-1,97,7,девелопер затянуться газопроводный проект смочь взыскать убыток,GAZP
2022-05-23,"Герхард Шредер отказался от предложения войти в совет директоров ""Газпрома""",0,0,trend,neutral,world,0,75,5,отказаться предложение войти совет директор,GAZP
2022-05-23,"Девелопер затянувшегося газопроводного проекта в Подмосковье не смог взыскать убытки с ""Газпрома""",0,0,trend,neutral,moscow,-1,97,7,девелопер затянуться газопроводный проект смочь взыскать убыток,GAZP
2022-05-25,"Продававшие акции ""Газпрома"" в четверг на слухах могли потерять около 0,5 млрд рублей",1,1,"trend,volatility",up_vol,business,0,85,8,продававшие акция четверг слух мочь потерять млрд рубль,GAZP
2022-05-25,"Индекс ""Мосбиржи"" превысил 2400 пунктов за счет ослабления рубля и ралли ""Газпрома""",1,1,"trend,volatility",up_vol,business,0,83,8,индекс мосбиржи превысить пункт счет ослабление рубль ралли,GAZP
2022-05-25,"Котировки ""Газпрома"" обновили максимум с 21 февраля на новости о дивидендах",1,1,"trend,volatility",up_vol,business,0,75,6,обновить максимум 21 февраль новость дивиденд,GAZP
2022-05-25,"Совет директоров ""Газпрома"" рекомендовал продолжить выплаты высоких дивидендов",1,1,"trend,volatility",up_vol,business,0,78,6,директор рекомендовать продолжить выплата высокий дивиденд,GAZP
2022-05-25,"""Газпромбанк"" предложил закрыть сведения о залогах",1,1,"trend,volatility",up_vol,business,0,50,4,предложить закрыть сведение залог,GAZP
2022-06-06,Газпромбанк представил обновленные макропрогнозы для РФ,0,0,trend,neutral,business,0,55,3,представить обновить макропрогноз,GAZP
2022-06-14,Заявка Газпрома на прокачку через Украину остается на уровне 42 млн куб. м,0,0,trend,neutral,business,0,74,7,заявка прокачка оставаться уровень млн куб м,GAZP
2022-06-14,"Рынок акций РФ начал неделю с умеренного роста индексов благодаря подъему ""Газпрома""",0,0,trend,neutral,business,0,84,8,рынок акция начать неделя умеренный рост индекс подъем,GAZP
2022-06-14,"""Газпром нефть"" получила лицензии на шесть участков Нижнепуринской группы",0,0,trend,neutral,business,0,73,7,газпром нефть получить лицензия участок нижнепуринский группа,GAZP
2022-06-22,"Лицензии на Тамбейскую группу оформлены на СП с ""РусГазДобычей"" ""Газпром добыча Тамбей""",1,1,"trend,volatility",up_vol,business,0,87,6,тамбейский группа оформить русгаздобыча газпром добыча,GAZP
2022-06-22,"Лицензии на Тамбейскую группу оформлены на СП с ""РусГазДобычей"" ""Газпром добыча Тамбей""",1,1,"trend,volatility",up_vol,business,0,87,6,тамбейский группа оформить русгаздобыча газпром добыча,GAZP
2022-06-23,"Минюст зарегистрировал приказы о повышении с июля регулируемых цен ""Газпрома""",-1,0,trend,down,business,0,77,6,зарегистрировать приказ повышение июль регулируемый цена,GAZP
2022-06-23,"ТПК купила сервис оплаты топлива на АЗС ""Газпромнефти"" и ""ЕКА""",-1,0,trend,down,business,0,62,5,купить сервис оплата топливо азс,GAZP
2022-06-29,"""Газпром"" – рекорд не засчитан. Обобщение",-1,1,"trend,volatility",down_vol,business,1,41,4,газпром рекорд засчитать обобщение,GAZP
2022-06-29,"""Газпром"" в сентябре-ноябре доплатит 1,25 трлн рублей НДПИ",-1,1,"trend,volatility",down_vol,business,0,58,5,газпром сентябрь-ноябрь доплатить трлн рубль,GAZP
2022-06-29,"Рынок акций РФ завершил полугодие падением вслед за обвалом ""Газпрома""",-1,1,"trend,volatility",down_vol,business,0,70,7,рынок акция завершить полугодие падение вслед обвал,GAZP
2022-06-29,"""Газпром"" – рекорд не засчитан. Обобщение",-1,1,"trend,volatility",down_vol,business,1,41,4,газпром рекорд засчитать обобщение,GAZP
2022-06-29,"""Газпром"" в сентябре-ноябре доплатит 1,25 трлн рублей НДПИ",-1,1,"trend,volatility",down_vol,business,0,58,5,газпром сентябрь-ноябрь доплатить трлн рубль,GAZP
2022-06-29,"Рынок акций РФ завершил полугодие падением вслед за обвалом ""Газпрома""",-1,1,"trend,volatility",down_vol,business,0,70,7,рынок акция завершить полугодие падение вслед обвал,GAZP
2022-07-04,"Рынок акций РФ просел во главе с ""Газпромом""",1,0,trend,up,business,0,44,4,рынок акция просесть глава,GAZP
2022-07-04,"""Славнефть"" вновь не заплатит дивиденды ""Роснефти"" и ""Газпром нефти""",1,0,trend,up,business,1,68,4,вновь заплатить дивиденд нефть,GAZP
2022-07-04,"Рынок акций РФ просел во главе с ""Газпромом""",1,0,trend,up,business,0,44,4,рынок акция просесть глава,GAZP
2022-07-04,"""Славнефть"" вновь не заплатит дивиденды ""Роснефти"" и ""Газпром нефти""",1,0,trend,up,business,1,68,4,вновь заплатить дивиденд нефть,GAZP
2022-07-11,"Суд не арестовал 1 млрд руб. на счетах Gemont по иску ""Газпром автоматизации""",0,0,trend,neutral,business,0,77,8,суд арестовать млрд руб счет иск газпром автоматизация,GAZP
2022-07-12,"""Газпром"" затруднился предсказать развитие ситуации с работой ""Северного потока""",-1,0,trend,down,business,1,80,8,газпром затрудниться предсказать развитие ситуация работа северный поток,GAZP
2022-07-18,"Газпромбанк может стать партнером ""Автодора"" в новой лизинговой компании",1,0,trend,up,business,0,72,6,мочь стать партнер новый лизинговый компания,GAZP
2022-07-19,"Путин связал санкции Канады против ""Газпрома"" с ее собственными планами на рынок ЕС",0,0,trend,neutral,russia,-1,83,5,связать санкция собственный план рынок,GAZP
2022-07-18,"Газпромбанк может стать партнером ""Автодора"" в новой лизинговой компании",1,0,trend,up,business,0,72,6,мочь стать партнер новый лизинговый компания,GAZP
2022-07-19,"Путин связал санкции Канады против ""Газпрома"" с ее собственными планами на рынок ЕС",0,0,trend,neutral,russia,-1,83,5,связать санкция собственный план рынок,GAZP
2022-07-25,"""Северсталь"" поставит ""Газпрому"" 84 тыс. тонн труб большого диаметра",0,0,trend,neutral,business,0,68,7,северсталь поставить тыс тонна труба большой диаметр,GAZP
2022-07-25,"Документы от Siemens по турбине ""СП-1"" не сняли всех вопросов у ""Газпрома""",0,0,trend,neutral,russia,0,74,5,документ турбина сп-1 снять вопрос,GAZP
2022-07-25,"""Газпром"" зафиксировал третий за месяц суточный рекорд поставок в КНР по ""Силе Сибири""",0,0,trend,neutral,business,1,86,8,газпром зафиксировать третий месяц суточный рекорд поставка сила,GAZP
2022-07-29,"""Газпром"" прекратил поставки в Латвию в связи с нарушением условий отбора",-1,0,trend,down,business,0,73,7,газпром прекратить поставка связь нарушение условие отбор,GAZP
2022-08-01,"""Молдовагаз"" попросил ""Газпром"" об отсрочке платежа за август",-1,0,trend,down,world,0,61,5,молдовагаз попросить отсрочка платеж август,GAZP
2022-08-02,"""Газпром"" заявил о невозможности возврата турбины на ""СП-1"" из-за действий Siemens",0,0,trend,neutral,business,0,82,7,газпром заявить невозможность возврат турбина сп-1 действие,GAZP
2022-08-02,"СК Белоруссии заподозрил менеджеров ""дочки"" ""Газпрома"" во взяточничестве",0,0,trend,neutral,world,0,72,4,заподозрить менеджер дочка взяточничество,GAZP
2022-08-09,"Молдавия не сможет в августе внести авансовый платеж ""Газпрому""",0,0,trend,neutral,world,0,63,5,смочь август внести авансовый платеж,GAZP
2022-08-09,"Сургутский завод ""Газпром переработки"" возобновил работу",0,0,trend,neutral,business,0,56,6,сургутский завод газпром переработка возобновить работа,GAZP
2022-08-15,"Акционеры ""Севернефтегазпрома"" решили не выплачивать дивиденды за 2021 год",1,1,"trend,volatility",up_vol,business,1,74,6,акционер решить выплачивать дивиденд 2021 год,GAZP
2022-08-15,"Молдавия заплатит за аудит долга перед ""Газпромом"" 800 тыс. евро",1,1,"trend,volatility",up_vol,world,0,64,5,заплатить аудит долг тыс евро,GAZP
2022-08-15,"Акционеры ""Севернефтегазпрома"" решили не выплачивать дивиденды за 2021 год",1,1,"trend,volatility",up_vol,business,1,74,6,акционер решить выплачивать дивиденд 2021 год,GAZP
2022-08-15,"Молдавия заплатит за аудит долга перед ""Газпромом"" 800 тыс. евро",1,1,"trend,volatility",up_vol,world,0,64,5,заплатить аудит долг тыс евро,GAZP
2022-08-22,"""Газпром"" согласился подождать аванса от Молдавии до 1 сентября",1,0,trend,up,world,0,63,6,газпром согласиться подождать аванс 1 сентябрь,GAZP
