date,title,label,label_volatility,impact_type,impact_class,section,sentiment,title_len,num_words,clean_title,ticker
2021-01-11,Путин обсудил с Макроном предстоящую трехстороннюю встречу по Карабаху,0,0,trend,neutral,russia,0,70,4,обсудить предстоящий трехсторонний встреча,AKRN
2021-04-19,"Макрон заявил, что применение ""Спутника V"" не ускорит вакцинацию в ЕС",0,0,trend,neutral,world,0,69,6,заявить применение спутник v ускорить вакцинация,AKRN
2021-04-19,"Макрон заявил, что во взаимоотношениях с РФ ""необходимо определить красные линии""",0,0,trend,neutral,world,0,81,6,заявить взаимоотношение необходимый определить красный линия,AKRN
2021-08-30,Макрон на примере Афганистана напомнил о невозможности навязать демократию,1,0,trend,up,world,0,74,5,пример напомнить невозможность навязать демократия,AKRN
2021-08-30,Макрон на примере Афганистана напомнил о невозможности навязать демократию,1,0,trend,up,world,0,74,5,пример напомнить невозможность навязать демократия,AKRN
2021-10-11,"Путин обсудил с Меркель и Макроном возможность проведения ""нормандского"" саммита",-1,0,trend,down,world,0,80,5,обсудить возможность проведение нормандский саммит,AKRN
2021-10-11,"Путин обсудил с Меркель и Макроном возможность проведения ""нормандского"" саммита",-1,0,trend,down,world,0,80,5,обсудить возможность проведение нормандский саммит,AKRN
2021-10-11,"Путин обсудил с Меркель и Макроном возможность проведения ""нормандского"" саммита",-1,0,trend,down,world,0,80,5,обсудить возможность проведение нормандский саммит,AKRN
2021-12-03,Макрон сообщил о планах ряда европейских стран открыть общее посольство в Кабуле,1,0,trend,up,world,0,80,8,сообщить план ряд европейский страна открыть общий посольство,AKRN
2021-12-13,Телемост с участием Путина и Макрона запланирован на следующую неделю,1,0,trend,up,russia,0,69,5,телемост участие запланировать следующий неделя,AKRN
2021-12-13,Телемост с участием Путина и Макрона запланирован на следующую неделю,1,0,trend,up,russia,0,69,5,телемост участие запланировать следующий неделя,AKRN
2022-01-04,Резкое высказывание Макрона о непривитых французах вновь вызвало скандал,-1,0,trend,down,world,0,72,7,резкий высказывание непривитый француз вновь вызвать скандал,AKRN
2022-01-04,Резкое высказывание Макрона о непривитых французах вновь вызвало скандал,-1,0,trend,down,world,0,72,7,резкий высказывание непривитый француз вновь вызвать скандал,AKRN
2022-01-10,"""Россети Северо-Запад"" проиграли ""Акрону"" суд на 145 млн рублей",1,1,"trend,volatility",up_vol,business,0,63,5,россеть проиграть суд млн рубль,AKRN
2022-01-10,"""Россети Северо-Запад"" проиграли ""Акрону"" суд на 145 млн рублей",1,1,"trend,volatility",up_vol,business,0,63,5,россеть проиграть суд млн рубль,AKRN
2022-01-10,"""Россети Северо-Запад"" проиграли ""Акрону"" суд на 145 млн рублей",1,1,"trend,volatility",up_vol,business,0,63,5,россеть проиграть суд млн рубль,AKRN
2022-01-31,Макрон призвал президента Ирана ускорить переговоры по атому,1,1,"trend,volatility",up_vol,world,0,60,5,призвать президент ускорить переговоры атом,AKRN
2022-01-31,Макрон призвал президента Ирана ускорить переговоры по атому,1,1,"trend,volatility",up_vol,world,0,60,5,призвать президент ускорить переговоры атом,AKRN
2022-02-02,Зеленский обсудил с Макроном дальнейшие шаги по поддержанию устойчивости Украины,1,1,"trend,volatility",up_vol,world,0,80,5,обсудить дальнейший шаг поддержание устойчивость,AKRN
2022-02-02,Путин и Макрон обсудили ситуацию вокруг Украины и гарантии безопасности РФ,1,1,"trend,volatility",up_vol,russia,0,74,4,обсудить ситуация гарантия безопасность,AKRN
2022-02-02,Зеленский обсудил с Макроном дальнейшие шаги по поддержанию устойчивости Украины,1,1,"trend,volatility",up_vol,world,0,80,5,обсудить дальнейший шаг поддержание устойчивость,AKRN
2022-02-02,Путин и Макрон обсудили ситуацию вокруг Украины и гарантии безопасности РФ,1,1,"trend,volatility",up_vol,russia,0,74,4,обсудить ситуация гарантия безопасность,AKRN
2022-02-04,Столтенберг сообщил о разговоре с Макроном по ситуации вокруг Украины,1,1,"trend,volatility",up_vol,world,0,69,3,сообщить разговор ситуация,AKRN
2022-02-11,Макрон обсудил связанные с Украиной темы с Шольцем и Зеленским,0,0,trend,neutral,world,0,62,3,обсудить связать тема,AKRN
2022-02-11,В Кремле подтвердили проведение телефонных переговоров Путина и Макрона,0,0,trend,neutral,world,0,71,4,подтвердить проведение телефонный переговоры,AKRN
2022-02-21,Макрон в ближайшие часы поговорит с президентом США и канцлером ФРГ,-1,1,"trend,volatility",down_vol,world,0,67,5,близкий час поговорить президент канцлер,AKRN
2022-02-21,Путин и Макрон обменялись мнениями по ситуации вокруг Украины,-1,1,"trend,volatility",down_vol,russia,0,61,3,обменяться мнение ситуация,AKRN
2022-02-21,Зеленский рассказал о содержании своей беседы с Макроном,-1,1,"trend,volatility",down_vol,world,0,56,3,рассказать содержание беседа,AKRN
2022-04-11,Макрон обвинил Ле Пен в тайном стремлении вывести Францию из ЕС,-1,1,"trend,volatility",down_vol,world,0,63,4,обвинить тайный стремление вывести,AKRN
2022-04-11,Макрон обвинил Ле Пен в тайном стремлении вывести Францию из ЕС,-1,1,"trend,volatility",down_vol,world,0,63,4,обвинить тайный стремление вывести,AKRN
2022-04-11,Макрон обвинил Ле Пен в тайном стремлении вывести Францию из ЕС,-1,1,"trend,volatility",down_vol,world,0,63,4,обвинить тайный стремление вывести,AKRN
2022-04-15,Макрон задумался о назначении министра по снижению зависимости Франции от нефти и газа,-1,0,trend,down,world,0,86,7,задуматься назначение министр снижение зависимость нефть газ,AKRN
2022-04-18,"""Непокоренная Франция"" сообщила о планах трети избирателей голосовать за Макрона",-1,0,trend,down,world,0,80,6,непокоренный сообщить план треть избиратель голосовать,AKRN
2022-04-18,"""Непокоренная Франция"" сообщила о планах трети избирателей голосовать за Макрона",-1,0,trend,down,world,0,80,6,непокоренный сообщить план треть избиратель голосовать,AKRN
2022-04-25,"Макрон после обработки 73% бюллетеней получает 53% голосов, Ле Пен - 47%",1,0,trend,up,world,0,72,4,обработка бюллетень получать голос,AKRN
2022-04-25,"Ле Пен назвала свои результаты ""громкой победой"", несмотря на победу Макрона",1,0,trend,up,world,0,76,6,назвать результат громкий победа несмотря победа,AKRN
2022-04-25,По подсчетам экзит-поллов Макрон лидирует на выборах Франции,1,0,trend,up,world,0,60,4,подсчет экзит-полл лидировать выбор,AKRN
2022-04-25,Бельгийский канал сообщил о преимуществе Макрона на выборах президента Франции,1,0,trend,up,world,0,78,6,бельгийский канал сообщить преимущество выбор президент,AKRN
2022-04-25,"Макрон после обработки 73% бюллетеней получает 53% голосов, Ле Пен - 47%",1,0,trend,up,world,0,72,4,обработка бюллетень получать голос,AKRN
2022-04-25,"Ле Пен назвала свои результаты ""громкой победой"", несмотря на победу Макрона",1,0,trend,up,world,0,76,6,назвать результат громкий победа несмотря победа,AKRN
2022-04-25,По подсчетам экзит-поллов Макрон лидирует на выборах Франции,1,0,trend,up,world,0,60,4,подсчет экзит-полл лидировать выбор,AKRN
2022-04-25,Бельгийский канал сообщил о преимуществе Макрона на выборах президента Франции,1,0,trend,up,world,0,78,6,бельгийский канал сообщить преимущество выбор президент,AKRN
2022-06-20,Коалиция Макрона теряет абсолютное большинство по итогам второго тура выборов,-1,0,trend,down,world,0,77,8,коалиция терять абсолютный большинство итог второй тур выбор,AKRN
2022-06-20,Коалиция Макрона теряет абсолютное большинство по итогам второго тура выборов,-1,0,trend,down,world,0,77,8,коалиция терять абсолютный большинство итог второй тур выбор,AKRN
2022-07-01,В городе Акрон в США отменили празднования после жестокого убийства чернокожего при задержании,-1,0,trend,down,world,0,94,7,город отменить празднование жестокий убийство чернокожий задержание,AKRN
2022-09-26,Макрон призвал Азербайджан и Армению срочно приступить к переговорам о мире,-1,1,"trend,volatility",down_vol,world,0,75,5,призвать срочно приступить переговоры мир,AKRN
2022-09-26,Макрон призвал Азербайджан и Армению срочно приступить к переговорам о мире,-1,1,"trend,volatility",down_vol,world,0,75,5,призвать срочно приступить переговоры мир,AKRN
2022-09-26,Макрон призвал Азербайджан и Армению срочно приступить к переговорам о мире,-1,1,"trend,volatility",down_vol,world,0,75,5,призвать срочно приступить переговоры мир,AKRN
2022-10-03,Макрон заявил о готовности работать вместе со странами ЕС над новыми санкциями против РФ,-1,0,trend,down,business,0,88,7,заявить готовность работать вместе страна новый санкция,AKRN
2022-10-03,Макрон заявил о готовности работать вместе со странами ЕС над новыми санкциями против РФ,-1,0,trend,down,business,0,88,7,заявить готовность работать вместе страна новый санкция,AKRN
2022-11-11,Алиев обсудил с Макроном нормализацию отношений с Ереваном,1,0,trend,up,world,0,58,3,обсудить нормализация отношение,AKRN
2023-02-20,Рейтинг Макрона во Франции упал на самый низкий за три года уровень,0,0,trend,neutral,world,0,67,6,рейтинг упасть самый низкий год уровень,AKRN
2023-03-01,"Макрон заявил о завершении унаследованной от колониализма эпохи ""французской Африки""",-1,0,trend,down,world,0,84,6,заявить завершение унаследовать колониализм эпоха французский,AKRN
2023-03-01,"Макрон заявил о завершении унаследованной от колониализма эпохи ""французской Африки""",-1,0,trend,down,world,0,84,6,заявить завершение унаследовать колониализм эпоха французский,AKRN
2023-08-07,"Глава МИД ЮАР заявила, что Макрона не приглашали на саммит БРИКС",0,0,trend,neutral,world,0,64,4,глава заявить приглашать саммит,AKRN
2023-09-08,Пашинян заявил Макрону о готовности к переговорам с Алиевым,-1,0,trend,down,world,0,59,3,заявить готовность переговоры,AKRN
2023-09-14,Макрон сравнил посла Франции в Нигере с заложником,0,0,trend,neutral,world,0,50,3,сравнить посол заложник,AKRN
2024-02-12,Макрон отложил визит на Украину по соображениям безопасности,1,0,trend,up,world,0,60,4,отложить визит соображение безопасность,AKRN
2024-04-11,Макрон и Шольц призвали к восстановлению баланса торговых отношений ЕС с Китаем,1,0,trend,up,world,0,79,5,призвать восстановление баланс торговый отношение,AKRN
2024-05-10,Макрон не исключил отправку французских военных на Украину,0,0,trend,neutral,world,0,58,4,исключить отправка французский военный,AKRN
2024-05-13,Макрон обсудил с Зеленским детали военной помощи Украине,-1,0,trend,down,world,0,56,4,обсудить деталь военный помощь,AKRN
2024-05-13,Макрон обсудил с Зеленским детали военной помощи Украине,-1,0,trend,down,world,0,56,4,обсудить деталь военный помощь,AKRN
2024-05-31,"Тольяттинский клуб ""Акрон"" вышел в РПЛ",-1,0,trend,down,https:,0,38,3,тольяттинский клуб выйти,AKRN
2024-08-20,"Левые угрожают Макрону импичментом, если он не одобрит их кандидата в премьеры",-1,0,trend,down,world,0,78,6,левый угрожать импичмент одобрить кандидат премьер,AKRN
2024-08-30,"Партия ""Непокоренная Франция"" подготовила предложение о старте импичмента Макрона",0,0,trend,neutral,world,0,81,6,партия непокоренный подготовить предложение старт импичмент,AKRN
2024-09-16,"Голевой пас Дзюбы помог ""Акрону"" крупно победить ""Химки""",1,0,trend,up,https:,0,56,5,голевой пас помочь крупно победить,AKRN
2024-09-16,"Голевой пас Дзюбы помог ""Акрону"" крупно победить ""Химки""",1,0,trend,up,https:,0,56,5,голевой пас помочь крупно победить,AKRN
2024-10-04,Нетаньяху осудил призыв Макрона прекратить поставки Израилю оружия для боев в Газе,1,0,trend,up,world,0,82,6,осудить призыв прекратить поставка оружие бой,AKRN
2024-10-04,Макрон высказался за прекращение поставок Израилю оружия для боев в Газе,1,0,trend,up,world,0,72,5,высказаться прекращение поставка оружие бой,AKRN
2024-10-07,"Нетаньяху заявил Макрону, что эмбарго на продажу оружия Израилю поможет Ирану",1,0,trend,up,world,0,77,5,заявить эмбарго продажа оружие помочь,AKRN
2024-10-22,"Нетаньяху заявил, что разочарован Макроном из-за призыва к эмбарго на оружие для Израиля",0,0,trend,neutral,world,0,88,5,заявить разочаровать призыв эмбарго оружие,AKRN
2024-12-12,Макрон призвал грузинский народ сохранить европейскую мечту,0,0,trend,neutral,world,0,59,6,призвать грузинский народ сохранить европейский мечта,AKRN
2025-01-06,Бывший президент Франции Олланд высказался против досрочной отставки Макрона,1,0,trend,up,world,0,76,5,бывший президент высказаться досрочный отставка,AKRN
2025-01-06,"Макрон считает, что Киев должен проявить реализм в случае переговоров",1,0,trend,up,world,0,69,6,считать должный проявить реализм случай переговоры,AKRN
2025-01-20,Макрон призвал укреплять оборонный суверенитет европейцев,0,0,trend,neutral,world,0,57,5,призвать укреплять оборонный суверенитет европеец,AKRN
2025-01-20,Макрон призвал укреплять оборонный суверенитет европейцев,0,0,trend,neutral,world,0,57,5,призвать укреплять оборонный суверенитет европеец,AKRN
2025-02-17,Макрон поговорил по телефону с Трампом перед совещанием по Украине в Париже,-1,0,trend,down,world,0,75,3,поговорить телефон совещание,AKRN
2025-02-17,Макрон поговорил по телефону с Трампом перед совещанием по Украине в Париже,-1,0,trend,down,world,0,75,3,поговорить телефон совещание,AKRN
2025-03-03,"Макрон полагает, что Трамп захочет восстановить контакты с Киевом",1,0,trend,up,world,0,65,4,полагать захотеть восстановить контакт,AKRN
2025-03-03,"Макрон полагает, что Трамп захочет восстановить контакты с Киевом",1,0,trend,up,world,0,65,4,полагать захотеть восстановить контакт,AKRN
2025-03-04,"Макрон заявил о ""российской угрозе"" для Франции и Европы",-1,0,trend,down,world,0,56,3,заявить российский угроза,AKRN
2025-03-04,Елисейский дворец опроверг планы Макрона поехать в Вашингтон вместе с Зеленским,-1,0,trend,down,world,0,79,6,елисейский дворец опровергнуть план поехать вместе,AKRN
2025-03-05,Словацкий премьер не согласился с инициативами Макрона по ядерному сдерживанию,-1,0,trend,down,world,0,78,6,словацкий премьер согласиться инициатива ядерный сдерживание,AKRN
2025-03-05,МИД РФ обвинил Макрона в попытке ядерного шантажа,-1,0,trend,down,russia,0,49,4,обвинить попытка ядерный шантаж,AKRN
2025-03-05,В партии французских ультраправых не согласны с мнением Макрона о главной угрозе для страны,-1,0,trend,down,world,0,91,8,партия французский ультраправый согласный мнение главный угроза страна,AKRN
2025-03-04,"Макрон заявил о ""российской угрозе"" для Франции и Европы",-1,0,trend,down,world,0,56,3,заявить российский угроза,AKRN
2025-03-04,Елисейский дворец опроверг планы Макрона поехать в Вашингтон вместе с Зеленским,-1,0,trend,down,world,0,79,6,елисейский дворец опровергнуть план поехать вместе,AKRN
2025-03-05,Словацкий премьер не согласился с инициативами Макрона по ядерному сдерживанию,-1,0,trend,down,world,0,78,6,словацкий премьер согласиться инициатива ядерный сдерживание,AKRN
2025-03-05,МИД РФ обвинил Макрона в попытке ядерного шантажа,-1,0,trend,down,russia,0,49,4,обвинить попытка ядерный шантаж,AKRN
2025-03-05,В партии французских ультраправых не согласны с мнением Макрона о главной угрозе для страны,-1,0,trend,down,world,0,91,8,партия французский ультраправый согласный мнение главный угроза страна,AKRN
2025-03-10,Макрон призвал военных 30 стран разработать гарантии безопасности для Украины,0,0,trend,neutral,world,0,77,6,призвать военный страна разработать гарантия безопасность,AKRN
2025-03-17,"ЦСКА обыграл ""Акрон"" в чемпионате России по футболу",0,0,trend,neutral,https:,0,51,3,обыграть чемпионат футбол,AKRN
2025-03-24,"Суд арестовал долг ""Акрона"" перед Societe Generale на 1,5 млрд рублей",1,1,"trend,volatility",up_vol,russia,-1,69,5,суд арестовать долг млрд рубль,AKRN
2025-03-24,"Суд арестовал долг ""Акрона"" перед Societe Generale на 1,5 млрд рублей",1,1,"trend,volatility",up_vol,russia,-1,69,5,суд арестовать долг млрд рубль,AKRN
2025-03-24,"Суд арестовал долг ""Акрона"" перед Societe Generale на 1,5 млрд рублей",1,1,"trend,volatility",up_vol,russia,-1,69,5,суд арестовать долг млрд рубль,AKRN
